[
  {
    "id": "native_stable",
    "display_name": "Native Stable",
    "canvas_noise": "none",
    "webgl_vendor": "native",
    "webgl_renderer": "native",
    "audio_noise": "none",
    "hardware_concurrency": 0,
    "device_memory": 0,
    "platform": "native",
    "screen_width": 0,
    "screen_height": 0,
    "color_depth": 24,
    "device_pixel_ratio": 0.0,
    "notes": "No fingerprint shaping. Uses actual hardware values. For real-identity daily-use sessions where compatibility matters most."
  },
  {
    "id": "balanced_stealth",
    "display_name": "Balanced Stealth",
    "canvas_noise": "subtle",
    "webgl_vendor": "Intel Inc.",
    "webgl_renderer": "Intel Iris OpenGL Engine",
    "audio_noise": "subtle",
    "hardware_concurrency": 4,
    "device_memory": 8,
    "platform": "Linux x86_64",
    "screen_width": 1920,
    "screen_height": 1080,
    "color_depth": 24,
    "device_pixel_ratio": 1.0,
    "notes": "Normalised common values. Canvas and audio noise injected. Matches a typical mid-range Linux workstation. For anonymous and I2P research personas."
  },
  {
    "id": "low_noise_obfuscated",
    "display_name": "Low-Noise Obfuscated",
    "canvas_noise": "aggressive",
    "webgl_vendor": "Mesa",
    "webgl_renderer": "Mesa Software Rasterizer",
    "audio_noise": "subtle",
    "hardware_concurrency": 2,
    "device_memory": 4,
    "platform": "Linux x86_64",
    "screen_width": 1280,
    "screen_height": 800,
    "color_depth": 24,
    "device_pixel_ratio": 1.0,
    "notes": "Aggressive canvas noise. Mesa software renderer strings reduce GPU surface leakage. Appears as minimal dual-core 4GB machine. For red-team and chained-route personas."
  },
  {
    "id": "minimal_surface",
    "display_name": "Minimal Surface",
    "canvas_noise": "aggressive",
    "webgl_vendor": "Mesa",
    "webgl_renderer": "Mesa Software Rasterizer",
    "audio_noise": "subtle",
    "hardware_concurrency": 2,
    "device_memory": 4,
    "platform": "Linux x86_64",
    "screen_width": 1024,
    "screen_height": 768,
    "color_depth": 24,
    "device_pixel_ratio": 1.0,
    "notes": "Maximum reduction. Very common screen dimensions and minimal hardware surface. Suitable for maximum-isolation research workflows. May break canvas-dependent sites."
  }
]
